{
  "week": 1,
  "date": "2026-07-13",
  "programme": "Programme Meridian",
  "pass": "2-score",
  "generated_by": "two-pass run: prompts/1-extract-classify.md then prompts/2-score.md, over data/transcripts/week-1.json, data/tickets.csv and data/board.json. Totals, ordering and movement written by score.py.",
  "prior_register": null,
  "notes": [
    "No prior register exists, so every item is new. Movement should not be read as calm.",
    "All six workstreams cleared the coverage floor this week: no assurance gap was raised."
  ],
  "coverage": {
    "meeting_duration_seconds": 2700,
    "airtime_seconds": {
      "platform": 520,
      "integration": 480,
      "data-migration": 430,
      "reporting": 400,
      "test": 390,
      "adoption": 360
    },
    "airtime_total_seconds": 2580,
    "transitions": {
      "platform": 2,
      "integration": 2,
      "data-migration": 2,
      "reporting": 2,
      "test": 2,
      "adoption": 3
    },
    "transitions_total": 13,
    "opened": {
      "platform": 0,
      "integration": 1,
      "data-migration": 1,
      "reporting": 1,
      "test": 2,
      "adoption": 1
    },
    "closed": {
      "platform": 2,
      "integration": 1,
      "data-migration": 1,
      "reporting": 2,
      "test": 1,
      "adoption": 0
    },
    "workstreams_reporting": 6,
    "workstreams_total": 6,
    "unverified_count": 4,
    "board": {
      "platform": "green",
      "integration": "green",
      "data-migration": "amber",
      "reporting": "green",
      "test": "green",
      "adoption": "green"
    }
  },
  "items": [
    {
      "id": "RK-03",
      "lineage": "rollback-rehearsal",
      "type": "risk",
      "title": "Cutover may proceed without a rehearsed rollback",
      "statement": "The rollback rehearsal for the cutover window has not been scheduled, has no owner and has no date, and the migration would go ahead with no proven way back.",
      "workstream": "data-migration",
      "owner": {
        "role": "Data migration lead",
        "stated": true,
        "basis": "raised it and holds the ticket"
      },
      "sources": [
        {
          "type": "ticket",
          "ticket_id": "DAT-304",
          "field": "status",
          "value": "Open",
          "observation": "Rollback rehearsal for the cutover window is open, due 2026-08-21, and has had no transition since 2026-07-13."
        },
        {
          "type": "transcript",
          "week": 1,
          "line": 8,
          "timestamp": "00:10:14",
          "speaker": "Data migration lead",
          "quote": "The rollback rehearsal has not happened. It is on the plan, nobody is against it, but I have not put a name against it yet."
        },
        {
          "type": "transcript",
          "week": 1,
          "line": 9,
          "timestamp": "00:11:40",
          "speaker": "Programme architect",
          "quote": "The rehearsal has to land before the cutover window opens or we are migrating without a way back."
        }
      ],
      "impact": 4,
      "likelihood": 3,
      "proximity": 3,
      "control": {
        "stated": true,
        "text": "On the plan, and nobody is against it.",
        "owner": null,
        "date": null,
        "score": 4,
        "anchor": "Mitigation mentioned but unowned, or an action stated with no substance."
      },
      "attention_factors": {
        "proximity": 3,
        "blast_radius": 3,
        "control_status": 4,
        "evidence_confidence": 2,
        "anchors": {
          "proximity": "Within 6 weeks. The cutover window is anchored to DAT-304's due date of 2026-08-21, 39 days out.",
          "blast_radius": "One other workstream is affected. TST-504 in test is blocked behind DAT-304.",
          "control_status": "Mitigation mentioned but unowned, or an action stated with no substance.",
          "evidence_confidence": "Two or more source types cover this and they agree."
        }
      },
      "hedge": {
        "present": false
      },
      "contradiction": {
        "present": false
      },
      "acceptance": {
        "state": "accepted",
        "by": "Delivery manager",
        "at": "2026-07-13",
        "note": null
      },
      "computed": {
        "attention": 3.1,
        "attention_terms": [
          {
            "factor": "proximity",
            "score": 3,
            "weight": 0.35,
            "product": 1.05
          },
          {
            "factor": "blast_radius",
            "score": 3,
            "weight": 0.25,
            "product": 0.75
          },
          {
            "factor": "control_status",
            "score": 4,
            "weight": 0.25,
            "product": 1.0
          },
          {
            "factor": "evidence_confidence",
            "score": 2,
            "weight": 0.15,
            "product": 0.3
          }
        ],
        "exposure": 12,
        "band": "high",
        "rank": 1,
        "group_rank": 1
      },
      "movement": {
        "measure": "exposure",
        "from": null,
        "to": 12,
        "note": "no prior register exists",
        "state": "new"
      }
    },
    {
      "id": "RK-02",
      "lineage": "contract-release-risk",
      "type": "risk",
      "title": "Integration cannot finalise field mapping until the v2 interface contract is published",
      "statement": "Integration's field mapping is contingent on a contract platform has committed to publish on 24 July; if that date moves, integration has no alternative path and the release date is exposed.",
      "workstream": "integration",
      "owner": {
        "role": "Platform lead",
        "stated": true,
        "basis": "stated ownership of the contract on the call"
      },
      "sources": [
        {
          "type": "ticket",
          "ticket_id": "PLT-208",
          "field": "due_date",
          "value": "2026-07-24",
          "observation": "Publish v2 interface contract is in progress and due on the date the platform lead committed to."
        },
        {
          "type": "transcript",
          "week": 1,
          "line": 5,
          "timestamp": "00:05:02",
          "speaker": "Integration lead",
          "quote": "Slowed. We are working against stubs. If the twenty-fourth moves we stop, because there is nothing else on that path."
        },
        {
          "type": "board",
          "workstream": "integration",
          "status": "green",
          "date": "2026-07-13",
          "observation": "Reported green, consistent with the spoken position that work is slowed rather than stopped."
        }
      ],
      "impact": 4,
      "likelihood": 2,
      "proximity": 5,
      "control": {
        "stated": true,
        "text": "It will not move. I own it and the review comments are minor.",
        "owner": "Platform lead",
        "date": "2026-07-24",
        "score": 0,
        "anchor": "Mitigation stated, owned, with a date."
      },
      "attention_factors": {
        "proximity": 5,
        "blast_radius": 5,
        "control_status": 0,
        "evidence_confidence": 2,
        "anchors": {
          "proximity": "Within 2 weeks. The committed publication date is 11 days out.",
          "blast_radius": "Programme-wide, or affects a party outside the programme. Two workstreams sit downstream of the contract and the programme architect named it as the highest-value item on the programme.",
          "control_status": "Mitigation stated, owned, with a date.",
          "evidence_confidence": "Two or more source types cover this and they agree."
        }
      },
      "hedge": {
        "present": false
      },
      "contradiction": {
        "present": false
      },
      "acceptance": {
        "state": "accepted",
        "by": "Delivery manager",
        "at": "2026-07-13",
        "note": null
      },
      "computed": {
        "attention": 3.3,
        "attention_terms": [
          {
            "factor": "proximity",
            "score": 5,
            "weight": 0.35,
            "product": 1.75
          },
          {
            "factor": "blast_radius",
            "score": 5,
            "weight": 0.25,
            "product": 1.25
          },
          {
            "factor": "control_status",
            "score": 0,
            "weight": 0.25,
            "product": 0.0
          },
          {
            "factor": "evidence_confidence",
            "score": 2,
            "weight": 0.15,
            "product": 0.3
          }
        ],
        "exposure": 8,
        "band": "medium",
        "rank": 2,
        "group_rank": 2
      },
      "movement": {
        "measure": "exposure",
        "from": null,
        "to": 8,
        "note": "no prior register exists",
        "state": "new"
      }
    },
    {
      "id": "RK-01",
      "lineage": "env-provisioning",
      "type": "risk",
      "title": "Integration test environment may not be provisioned before the integration milestone",
      "statement": "The provisioning request for the integration test environment has been raised and not actioned; if it is not delivered by the end of the month the integration milestone moves and two workstreams replan around it.",
      "workstream": "test",
      "owner": {
        "role": "Test lead",
        "stated": true,
        "basis": "raised it and is the ticket assignee"
      },
      "sources": [
        {
          "type": "ticket",
          "ticket_id": "TST-506",
          "field": "status",
          "value": "Open",
          "observation": "Environment provisioning for integration test was raised on 2026-07-13 with a due date of 2026-07-24 and has had no transition since."
        },
        {
          "type": "transcript",
          "week": 1,
          "line": 12,
          "timestamp": "00:16:05",
          "speaker": "Test lead",
          "quote": "I think we will get it. Probably by the end of the month, all being well."
        },
        {
          "type": "transcript",